<?xml version="1.0" encoding="UTF-8"?>
<!DOCTYPE paises SYSTEM "../dtd/ejercicio2.dtd">
<paises>
    <pais poblacion="47100396" nombre="España">
        <idioma nacional="si">Castellano</idioma>
        <idioma nacional="no">Euskera</idioma>
        <idioma nacional="no">Gallego</idioma>
        <capital>Madrid</capital>
    </pais>
    <pais nombre="Irlanda" poblacion="4857000">
        <idioma nacional="si">Irlandés</idioma>
        <idioma nacional="si">Inglés</idioma>
        <capital>Dublín</capital>
    </pais>
    <pais nombre="Portugal"/>
</paises>